Decision,Sum,round_1_result (eoan),round_1_notes,round_2_result (ai),round_2_notes,round_3_result (ai),round_3_notes,round_2_full_output,round_3_full_output,record_id,DOI,Author,Title,Publication Title,ISBN,ISSN,Url,Date,Series,Series Number,Series Text,Series Title,Publisher,Place,Abstract,ISBNs,Funding Information,PDF Link,Author Keywords,Mesh_Terms,Article Citation Count,Patent Citation Count,Reference Count,License,Issue Date,Meeting Date,Author full names,Author(s) ID,Year,Source title,Art. No.,Page start,Page end,Page count,Cited by,Link,Publication Stage,Open Access,Source,EID,Keywords,exported_notes_1,asreview_ranking,asreview_prior
Included,2,0,EC5,1,IC5,1,IC5,INCLUDE - IC5,INCLUDE - IC5,192,10.23919/ITC.2017.8065706,Carrega A.; Repetto M.,Energy-Aware Consolidation Scheme for Data Center Cloud Applications,,,,,,,,,,,,"The consolidation of resources is one of the most efficient strategies to reduce the power consumption in data centers. Various algorithms have been proposed in order to reduce the total number of required servers and network devices. The practice developed in response to the problem of server sprawl, a situation in which multiple, under-utilized servers (and/or network devices) take up more space and consume more resources than the ones justified by their workload; with the effect to power off unused equipment. Generally, consolidation mechanisms consider different parameters related to the services neglecting the specific function of the Virtual Machines (VMs) in the application framework (e.g., core component, backup replica, member of a set of workers for load balancing). In this work, we develop a new consolidation algorithm that takes into account the particular function of each VM with the aim to apply power saving mechanisms without compromising the desired service level. The results of the simulations show that it is possible to obtain significant energy savings. In particular, we show, with different heuristics, the optimal trade-off between service level and power efficiency achieved by the proposed model. © 2017 ITC Press.",,,,,,,,,,,,"Carrega, Alessandro (36633941300); Repetto, Matteo (57194639871)",36633941300; 57194639871,2017,"Proceedings of the 29th International Teletraffic Congress, ITC 2017",8065706,24,29,5,6,https://www.scopus.com/inward/record.uri?eid=2-s2.0-85040237525&doi=10.23919%2fITC.2017.8065706&partnerID=40&md5=c8494f78800f2081eac4dbf0130af96d,Final,,Scopus,2-s2.0-85040237525,Economic and social effects; Energy conservation; Energy efficiency; Power management; Application frameworks; Cloud applications; Consolidation mechanisms; Core components; Efficient strategy; Network devices; Power efficiency; Power saving mechanism; Green computing,EC3,127,0
Included,2,0,EC5,1,IC5,1,IC5,INCLUDE - IC5,INCLUDE - IC5,141,10.1109/TCSET49122.2020.235378,A. Luntovskyy; B. Shubyn,Highly-Distributed Systems Based on Micro-Services and their Construction Paradigms,"2020 IEEE 15th International Conference on Advanced Trends in Radioelectronics, Telecommunications and Computer Engineering (TCSET)",,,,07-May-20,,,,,IEEE,,"A definition for the HDS, as well as the demarcation to conventional distributed systems, were given. Typical architectures for HDS were discussed which affect increasing of QoS and of so-called QoE (Quality of Experience). The distinguishing features for HDS are clearly formulated. The advanced SWT (Software Technologies) approaches lead to use of young flexible service-oriented architectures like Micro-Services, which provide higher performance and small latencies, as well as better scalability, energy-efficiency and autarky.One possible option in the frame of HDS regarding security, privacy, authentication and compulsoriness of workflow steps, modules and service execution for such apps Blockchain and Smart Contracting are. The theoretical issues are proven via the represented examples and case studies.",978-1-7281-5566-1,,https://ieeexplore.ieee.org/stamp/stamp.jsp?arnumber=9088603,Highly-Distributed Systems;Agile Process Models;Quality of Experience;Service-Oriented Architectures;Micro-Services;DevOps;Scrum;Conway’s Law;Blockchain,,9,,12,IEEE,,,,,,,,,,,,,,,,,,IC4,128,0
Included,2,0,EC5,1,IC5,1,IC5,INCLUDE - IC5,INCLUDE - IC5,97,10.1109/ICWS62655.2024.00079,M. S. Floroiu; S. Russo; L. Giamattei; A. Guerriero; I. Malavolta; R. Pietrantuono,Anomaly Detection and Root Cause Analysis of Microservices Energy Consumption,2024 IEEE International Conference on Web Services (ICWS),,2836-3868,,15-Oct-24,,,,,IEEE,,"With the expansion of cloud computing and data centers, the need has arisen to tackle their environmental impact. The increasing adoption of microservice architectures, while offering scalability and flexibility, poses new challenges in the effective management of systems’ energy consumption.This study analyzes experimentally the effectiveness, with respect to energy consumption, of algorithms for Anomaly Detection (AD) and Root Cause Analysis (RCA) for (containerized) microservices systems. The study analyzes five AD and three RCA algorithms. Metrics to assess the effectiveness of AD algorithms are Precision, Recall, and F-Score. For RCA algorithms, the chose metric is Precision at level k. Two subjects of different complexity are used: Sock Shop and UNI-Cloud. Experiments use a cross-over paired comparison design, involving multiple randomized runs for robust measures.The experiments show that AD algorithms exhibit a relatively moderate performance. The mean adjusted Precision for Sock Shop is 61.5%, while it is 75% for the best-performing algorithms (BIRCH, KNN, and SVM) on UNI-Cloud. The Recall and F-Score for UNI-Cloud, for the same algorithms, are 75%, while for Sock Shop KNN yields the best outcome at roughly 45%. MicroRCA and RCD emerge as the top-performing algorithms for RCA.We found that the effectiveness of AD algorithms is strongly influenced by anomaly thresholds, emphasizing the importance of careful tuning such algorithms. RCA algorithms reveal promising results, particularly RCD and MicroRCA, which showed robust performance. However, challenges remain, as seen with the ϵ-diagnosis algorithm, suggesting the need for further refinement.For DevOps engineers, the findings highlight the need to carefully select and tune AD and RCA algorithms for energy, and to take into account system topology and monitoring configurations.",979-8-3503-6855-0,,https://ieeexplore.ieee.org/stamp/stamp.jsp?arnumber=10707452,Microservices;Energy consumption;Anomaly Detection;Root Cause Analysis,,,,39,IEEE,,,,,,,,,,,,,,,,,Measurement;Energy consumption;Root cause analysis;Web services;Software algorithms;Microservice architectures;Nearest neighbor methods;Topology;Anomaly detection;Tuning,,129,0
Included,2,0,EC5,1,IC5,1,IC5,INCLUDE - IC5,INCLUDE - IC5,125,10.1109/JSEN.2024.3502254,D. Loconte; S. Ieva; F. Gramegna; I. Bilenchi; C. Fasciano; A. Pinto; G. Loseto; F. Scioscia; M. Ruta; E. Di Sciascio,Serverless Microservice Architecture for Cloud-Edge Intelligence in Sensor Networks,IEEE Sensors Journal,,1558-1748,,25-Nov-24,,,,,IEEE,,"Machine learning (ML) is increasingly exploited in a wide range of application areas to analyze data streams from large-scale sensor networks, train predictive models, and perform inference. The cloud-edge intelligence (CEI) computing paradigm integrates cloud infrastructures for resource-intensive ML tasks with devices at the border of a local network for distributed data preprocessing, small-scale model training, and prediction tasks. This can achieve a tunable trade-off of ML accuracy with improved data privacy, response latency, and bandwidth usage. Prevalent CEI architectures are based on microservices encapsulated in containers, but serverless computing is emerging as an alternative model. It is based on stateless event-driven functions to facilitate the development and provisioning of application components, increase the infrastructure elasticity, and reduce management effort. This article proposes a novel CEI framework for sensor-based applications, exploiting serverless computing for data management and ML tasks. Small-scale model training occurs at the edge with local data for quick prediction response, while large-scale models are trained in the cloud with the full sensor network data, and then, they are fed back to edge nodes for a progressive accuracy improvement. A fully functional prototype has been built by leveraging open-source software tools, selected devices for field sensing and edge computing (EC), and a commercial cloud platform. Experiments validate the feasibility and sustainability of the proposal, compared with an existing container-oriented microservice architecture.",,"Spoke 9 of the Italian National Center for High-Performance Computing, Big Data and Quantum Computing; Digital Enterprise Grant; Lutech S.p.A. and European Regional Development Fund for Apulia Region 2014/2020 Operating Program; ",https://ieeexplore.ieee.org/stamp/stamp.jsp?arnumber=10767204,Cloud-edge intelligence (CEI);machine learning (ML);microservices;sensor networks;serverless computing,,,,41,CCBY,,,,,,,,,,,,,,,,,Cloud computing;Sensors;Training;Computer architecture;Microservice architectures;Computational modeling;Data models;Accuracy;Internet of Things;Intelligent sensors,IC4,132,0
Included,2,0,EC5,1,IC5,1,IC5,INCLUDE - IC5,INCLUDE - IC5,175,10.1145/3575693.3575710,"Switzer, Jennifer; Marcano, Gabriel; Kastner, Ryan; Pannuto, Pat",Junkyard Computing: Repurposing Discarded Smartphones to Minimize Carbon,"Proceedings of the 28th ACM International Conference on Architectural Support for Programming Languages and Operating Systems, Volume 2",978-1-4503-9916-6,,https://doi.org/10.1145/3575693.3575710,2023,ASPLOS 2023,,,,Association for Computing Machinery,"New York, NY, USA","1.5 billion smartphones are sold annually, and most are decommissioned less than two years later. Most of these unwanted smartphones are neither discarded nor recycled but languish in junk drawers and storage units. This computational stockpile represents a substantial wasted potential: modern smartphones have increasingly high-performance and energy-efficient processors, extensive networking capabilities, and a reliable built-in power supply. This project studies the ability to reuse smartphones as ""junkyard computers."" Junkyard computers grow global computing capacity by extending device lifetimes, which supplants the manufacture of new devices. We show that the capabilities of even decade-old smartphones are within those demanded by modern cloud microservices and discuss how to combine phones to perform increasingly complex tasks. We describe how current operation-focused metrics do not capture the actual carbon costs of compute. We propose Computational Carbon Intensity—a performance metric that balances the continued service of older devices with the superlinear runtime improvements of newer machines. We use this metric to redefine device service lifetime in terms of carbon efficiency. We develop a cloudlet of reused Pixel 3A phones. We analyze the carbon benefits of deploying large, end-to-end microservice-based applications on these smartphones. Finally, we describe system architectures and associated challenges to scale to cloudlets with hundreds and thousands of smartphones.",,,,,,,,,,,,,,,,,,,,,,,,,,cloud computing; sustainability; life cycle assessment,IC4,134,0
Included,2,0,EC5,1,IC5,1,IC5,INCLUDE - IC5,INCLUDE - IC5,138,10.1109/SDS64317.2024.10883885,U. Vora,Architecting a SDS for Microservices-based Distributed Edge Computing Systems,2024 11th International Conference on Software Defined Systems (SDS),,,,18-Feb-25,,,,,IEEE,,"Software Defined Systems (SDS) abstract the actual hardware at different layers with software components, layers such as Networking, Storage, Security, Servers, Data Centers, Clouds etc. This abstraction facilitates construction, integration / composition and management of complex systems effectively and sustainably. Microservices architecture is increasingly being used for designing and deploying large-scale application systems in both cloud-based and enterprise infrastructures where relatively small, loosely coupled microservices communicate with each other using lightweight communication protocols and abstract complex software application(s). We propose a sustainable SDS architecture to manage microservices of a distributed edge computing system which reduces dependency on any data centre / cloud infrastructure.",979-8-3315-1832-5,,https://ieeexplore.ieee.org/stamp/stamp.jsp?arnumber=10883885,Microservices;Edge computing;Software Defined System;Sustainability,,,,14,IEEE,,,,,,,,,,,,,,,,,Cloud computing;Data centers;Microservice architectures;Computer architecture;Software;Software measurement;Servers;Transient analysis;Complex systems;Edge computing,IC4,140,0
Included,2,0,EC5,1,IC6,1,IC6,INCLUDE - IC6,INCLUDE - IC6,1,10.1002/spe.3217,Wu J.; Zhang J.; Zhang Y.; Wen Y.,Constraint-aware and multi-objective optimization for micro-service composition in mobile edge computing,,,,,,,,,,,,"As a new paradigm of distributed computing, mobile edge computing (MEC) has gained increasing attention due to its ability to expand the capabilities of centralized cloud computing. In MEC environments, a software application typically consists of multiple micro-services, which can be composed together in a flexible manner to achieve various user requests. However, the composition of micro-services in MEC is still a challenging research issue arising from three aspects. Firstly, composite micro-services constructed by ignoring the processing capabilities of different micro-services may cause waste of edge resources. Secondly, edge servers' limitations in terms of computational power can easily cause service occupancy between composite micro-services, severely affecting the user experience. Thirdly, in dynamic and unstable mobile environments, different edge users have different sensitivities to request latency, which increases the complexity of micro-service composition. In order to improve edge resource utilization and user experience on micro-service invocations, in this paper, we comprehensively consider the above three factors, and we first model the micro-services composition problem in MEC as a constrained multi-objective optimization problem. Then, a micro-service composition optimization method M3C combining graph search and branch-and-bound strategy is proposed to find a composition solution set with low energy consumption and high success rate for multiple edge users. Finally, we perform a series of experiments on two widely used datasets. Experimental results show that our proposed approach significantly outperforms the four competing baseline approaches, and that it is sufficiently efficient for practical deployment. © 2023 John Wiley & Sons Ltd.",,,,micro-service composition; micro-services; mobile edge computing; multi-objective optimization,,,,,,,,"Wu, Jintao (57188570943); Zhang, Jingyi (57215070911); Zhang, Yiwen (38863602600); Wen, Yiping (24451504400)",57188570943; 57215070911; 38863602600; 24451504400,2024,Software - Practice and Experience,,1596,1620,24,5,https://www.scopus.com/inward/record.uri?eid=2-s2.0-85159077377&doi=10.1002%2fspe.3217&partnerID=40&md5=e55bd825337409e2597a6046f99a32d2,Final,,Scopus,2-s2.0-85159077377,Application programs; Branch and bound method; Constrained optimization; Energy utilization; Mobile edge computing; Quality of service; Centralised; Cloud-computing; Computing environments; Edge resources; Micro services; Micro-service composition; Multi-objectives optimization; Services composition; Users' experiences; Multiobjective optimization,IC4,142,0
Included,2,0,EC5,1,IC5,1,IC5,INCLUDE - IC5,INCLUDE - IC5,54,10.1109/ACCESS.2024.3489892,S. D. Meglio; L. Libero Lucio Starace,Evaluating Performance and Resource Consumption of REST Frameworks and Execution Environments: Insights and Guidelines for Developers and Companies,IEEE Access,,2169-3536,,01-Nov-24,,,,,IEEE,,"The REST (REpresentational State Transfer) paradigm has become essential for designing distributed applications that leverage the HTTP protocol, enabling efficient data exchange and the development of scalable architectures such as microservices. However, selecting an appropriate framework among the myriad available options, especially given the diversity of emerging execution environments, presents a significant challenge. Often, this decision neglects crucial factors such as performance and energy efficiency, favoring instead developer familiarity and popularity within the industry. To address this, we conducted a comprehensive benchmark study using a prototype REST API application provided by an industry partner, which was implemented multiple times using different REST API frameworks. We evaluated five different REST API frameworks across three popular programming languages, incorporating both traditional and emerging execution environments, resulting in twelve distinct configurations. Our results reveal significant differences in performance and computational resource consumption across different frameworks and execution environments, highlighting the necessity of making informed technology choices based on thorough analysis rather than convenience or familiarity. In addition to our findings, we offer other contributions to the field: an automated pipeline that benchmarks different configurations with various frameworks and execution environments, and a reference benchmark REST API that can be used in other studies. This research provides valuable insights and tools for developers and organizations aiming to select high-performance, resource-efficient technologies that promote environmental sustainability and reduce operational costs.",,Piano Nazionale di Ripresa e Resilienza Ministero dell’Università e della Ricerca(grant numbers:PE0000013-FAIR);,https://ieeexplore.ieee.org/stamp/stamp.jsp?arnumber=10741246,Execution environments;green computing;performance benchmark;performance testing;REST API;REST API frameworks;sustainable computing;web applications,,,,64,CCBY,,,,,,,,,,,,,,,,,Java;Benchmark testing;Python;Energy consumption;Energy efficiency;Sports;Software development management;Prototypes;Costs;Codes;Green computing;Green computing;Web services,IC4,143,0
Included,2,0,EC4,1,IC5,1,IC5,INCLUDE - IC5,INCLUDE - IC5,102,10.1109/INFOCOMWKSHPS61880.2024.10620732,J. Gómez-DelaHiz; A. Fakhreddine; J. M. Murillo; J. Galán-Jiménez,Joint Optimization of Throughput and Energy Consumption in Microservices-Based UAV Networks,IEEE INFOCOM 2024 - IEEE Conference on Computer Communications Workshops (INFOCOM WKSHPS),,2833-0587,,13-Aug-24,,,,,IEEE,,"The application of Unmanned Aerial Vehicle (UAV) networks to the coverage problem in rural and low-income areas is actively studied nowadays by the research community. A UAV-based network infrastructure is different from traditional cellular networks relying on Base Stations. By mounting small cells on top of UAVs, coverage can be enhanced in regions where network operators avoid to invest due to the low Return on Investment. In case there is a requirement for an enhanced throughput in a rural area (e.g., users requesting IoT applications with strict QoS requriements), a potential solution is to place several UAV s over the same area, thus maximizing the offered throughput. However, this situation would lead to an increase in the energy consumption. To tackle this problem, this paper proposes an optimal solution to the problem of jointly maximizing the offered throughput in rural scenarios where users request microservice-based IoT applications, while minimizing the energy consumption of the swarm of UAV s. A Mixed Integer Linear Programming (MILP)-based formulation is defined and evaluated over realistic scenarios. Experimental results demonstrate how the solution is able to perform UAV placement in a way to maximize the offered throughput in the highest number of areas, while minimizing the total number of deployed UAVs.",979-8-3503-8447-5,,https://ieeexplore.ieee.org/stamp/stamp.jsp?arnumber=10620732,UAV;Throughput;Optimization;MILP;Rural areas,,,,29,IEEE,,,,,,,,,,,,,,,,,Energy consumption;Costs;Microservice architectures;Quality of service;Throughput;Autonomous aerial vehicles;Mixed integer linear programming,IC4,145,0
Included,2,0,EC5,1,IC5,1,IC5,INCLUDE - IC5,INCLUDE - IC5,126,10.1109/LATINCOM.2017.8240185,C. L. Chamas; D. Cordeiro; M. M. Eler,"Comparing REST, SOAP, Socket and gRPC in computation offloading of mobile applications: An energy cost analysis",2017 IEEE 9th Latin-American Conference on Communications (LATINCOM),,,,28-Dec-17,,,,,IEEE,,"There has been a high concern regarding the energy saving on mobile devices recently, for mobile devices have been performing increasingly complex tasks over time. The computation offloading is one of the most popular techniques used by developers as an effective way of saving energy on mobile devices, which consists on executing complex tasks in external servers with different purposes including save energy. Deciding towards offloading certain tasks requires to understand the influence of the amount of data, amount of computation, and the network profile. Several studies have investigated the influence of different wireless flavours, such as 3G, 4G and wifi, but no study has investigated the influence of the communication choices on the energy cost. Therefore, in this paper, we present an experiment we conducted to evaluate the energy consumption of different communication protocols and architectural styles, namely REST, SOAP, Socket and gRPC, when executing algorithms of different complexities and different input sizes and types. Results show that local execution is more economic with less complex algorithms and small input data. When it comes to remote execution, REST is the most economic choice followed by Socket. Moreover, our data show that computation offloading can save up to 10 time as much energy when compared to local execution for some executions configurations.",978-1-5386-2098-4,,https://ieeexplore.ieee.org/stamp/stamp.jsp?arnumber=8240185,,,5,,19,IEEE,,,,,,,,,,,,,,,,,Batteries;Energy consumption;Sorting;Mobile handsets;Sockets;Servers,EC3 but might be interesting,146,0
Included,2,0,EC4,1,IC5,1,IC5,INCLUDE - IC5,INCLUDE - IC5,194,10.23919/WMNC56391.2022.9954292,J. Galán-Jiménez; A. G. Vegas; J. Berrocal,Energy-efficient deployment of IoT applications in remote rural areas using UAV networks,2022 14th IFIP Wireless and Mobile Networking Conference (WMNC),,2473-3644,,25-Nov-22,,,,,IEEE,,"The Internet penetration rates are increasing every year, reaching more than 80% in developed countries. However, there are at least two billion people living in rural and low-income areas experiencing a complete lack of Internet connectivity, which prevents the deployment of key services such as remote health-care, emergency services, remote learning, or personal communications. In order to bring services closer to people living in rural areas, this paper exploits the capabilities of Unmanned Aerial Vehicles (UAVs) to propose an UAV-based network architecture and an energy-efficient algorithm to deploy IoT applications that can improve the quality of life of rural population. In particular, IoT applications are decomposed into microservices, which are deployed into a subset of UAVs to overcome the limitations of running the whole IoT application at a single UAV, which could result in worse outcomes due to their battery and computation limitations. Simulation results over a realistic scenario show the effectiveness of the proposed solution, evaluating the percentage of IoT requests that are served to users in the area under evaluation and reducing the energy consumption required by UAVs when handling such requests.",978-3-903176-52-2,European Regional Development Fund;,https://ieeexplore.ieee.org/stamp/stamp.jsp?arnumber=9954292,Energy efficiency;UAV;IoT;microservices;digital divide,,9,,8,,,,,,,,,,,,,,,,,,Wireless communication;Energy consumption;Simulation;Sociology;Microservice architectures;Network architecture;Autonomous aerial vehicles,IC4,155,0
