Decision,Sum,round_1_result (eoan),round_1_notes,round_2_result (ai),round_2_notes,round_3_result (ai),round_3_notes,round_2_full_output,round_3_full_output,record_id,DOI,Author,Title,Publication Title,ISBN,ISSN,Url,Date,Series,Series Number,Series Text,Series Title,Publisher,Place,Abstract,ISBNs,Funding Information,PDF Link,Author Keywords,Mesh_Terms,Article Citation Count,Patent Citation Count,Reference Count,License,Issue Date,Meeting Date,Author full names,Author(s) ID,Year,Source title,Art. No.,Page start,Page end,Page count,Cited by,Link,Publication Stage,Open Access,Source,EID,Keywords,exported_notes_1,asreview_ranking,asreview_prior
Included,3,1,IC6,1,IC5,1,IC5,INCLUDE - IC5,INCLUDE - IC5,164,10.1145/3307650.3322227,"Sriraman, Akshitha; Dhanotia, Abhishek; Wenisch, Thomas F.",SoftSKU: optimizing server architectures for microservice diversity @scale,Proceedings of the 46th International Symposium on Computer Architecture,978-1-4503-6669-4,,https://doi.org/10.1145/3307650.3322227,2019,ISCA '19,,,,Association for Computing Machinery,"New York, NY, USA","The variety and complexity of microservices in warehouse-scale data centers has grown precipitously over the last few years to support a growing user base and an evolving product portfolio. Despite accelerating microservice diversity, there is a strong requirement to limit diversity in underlying server hardware to maintain hardware resource fungibility, preserve procurement economies of scale, and curb qualification/test overheads. As such, there is an urgent need for strategies that enable limited server CPU architectures (a.k.a ""SKUs"") to provide performance and energy efficiency over diverse microservices. To this end, we first undertake a comprehensive characterization of the top seven microservices that run on the compute-optimized data center fleet at Facebook.Our characterization reveals profound diversity in OS and I/O interaction, cache misses, memory bandwidth utilization, instruction mix, and CPU stall behavior. Whereas customizing a CPU SKU for each microservice might be beneficial, it is prohibitive. Instead, we argue for ""soft SKUs"", wherein we exploit coarse-grain (e.g., boot time) configuration knobs to tune the platform for a particular microservice. We develop a tool, μSKU, that automates search over a soft-SKU design space using A/B testing in production and demonstrate how it can obtain statistically significant gains (up to 7.2% and 4.5% performance improvement over stock and production servers, respectively) with no additional hardware requirements.",,,,,,,,,,,,,,,,,,,,,,,,,,microservice; resource fungibility; soft SKU,IC4,57,0
Included,3,1,IC5,1,IC5,1,IC5,INCLUDE - IC5,INCLUDE - IC5,47,10.1109/ACCESS.2023.3340195,I. Fé; T. A. Nguyen; A. B. Soares; S. Son; E. Choi; D. Min; J. -W. Lee; F. A. Silva,Model-Driven Dependability and Power Consumption Quantification of Kubernetes-Based Cloud-Fog Continuum,IEEE Access,,2169-3536,,07-Dec-23,,,,,IEEE,,"System dependability is pivotal for the reliable execution of designated computing functions. With the emergence of cloud-fog computing and microservices architectures, new challenges and opportunities arise in evaluating system dependability. Enhancing dependability in microservices often involves component replication, potentially increasing energy costs. Thus, discerning optimal redundancy strategies and understanding their energy implications is crucial for both cost efficiency and ecological sustainability. This paper presents a model-driven approach to evaluate the dependability and energy consumption of cloud-fog systems, utilizing Kubernetes, a container application orchestration platform. The developed model considers various determinants affecting system dependability, including hardware and software reliability, resource accessibility, and support personnel availability. Empirical studies validate the model’s effectiveness, demonstrating a 22.33% increase in system availability with only a 1.33% rise in energy consumption. Moreover, this methodology provides a structured framework for understanding cloud-fog system dependability, serves as a reference for comparing dependability across different systems, and aids in resource allocation optimization. This research significantly contributes to the efforts to enhance cloud-fog system dependability.",,"Basic Science Research Program through the National Research Foundation of Korea (NRF); Ministry of Education(grant numbers:2020R1A6A1A03046811,2021R1A2C2094943); ",https://ieeexplore.ieee.org/stamp/stamp.jsp?arnumber=10347188,Cloud-fog continuum;dependability;Kubernetes;stochastic modeling,,1,,47,CCBYNCND,,,,,,,,,,,,,,,,,Modeling;Stochastic processes;Power demand;Energy consumption;Edge computing;Cloud computing,IC4,58,0
Included,3,1,IC5,1,IC5,1,IC5,INCLUDE - IC5,INCLUDE - IC5,12,10.1007/978-3-319-67639-5_17,Carrega A.; Repetto M.,Green and heuristics-based consolidation scheme for data center cloud applications,,,,,,,,,,,,"The consolidation of resources is one of the most efficient strategies to reduce the power consumption in data centers. Various algorithms have been proposed in order to reduce the total number of required servers and network devices. The practice developed in response to the problem of server sprawl, a situation in which multiple, under-utilized servers (and/or network devices) take up more space and consume more resources than can be justified by their workload; with the effect to power off unused equipment. Generally, consolidation mechanisms consider different parameters related to the services neglecting the specific function of the Virtual Machines (VMs) in the application framework (e.g., core component, backup replica, member of a set of workers for load balancing). In this work, we developed a new consolidation algorithm that takes into account the particular function of each VM with the aim to apply power saving mechanisms without compromising the desired service level. The results of the simulations show that it is possible to obtain significant values of energy saving. In particular, we show, with different heuristics, the optimal trade-off between service level and power efficiency achieved by the proposed model. © Springer International Publishing AG 2017.",,,,Cloud applications; Consolidation; Energy-aware; Green; Heuristics; Optimization; Virtual machines,,,,,,,,"Carrega, Alessandro (36633941300); Repetto, Matteo (57194639871)",36633941300; 57194639871,2017,Communications in Computer and Information Science,,230,250,20,0,https://www.scopus.com/inward/record.uri?eid=2-s2.0-85030153378&doi=10.1007%2f978-3-319-67639-5_17&partnerID=40&md5=07c6e2decd8494327c6f9a69973444a1,Final,,Scopus,2-s2.0-85030153378,Consolidation; Digital communication systems; Economic and social effects; Energy conservation; Energy efficiency; Network security; Optimization; Power management; Virtual machine; Application frameworks; Cloud applications; Consolidation mechanisms; Efficient strategy; Energy aware; Green; Heuristics; Power saving mechanism; Green computing,IC3,59,0
Included,3,1,IC6,1,IC5,1,IC6,INCLUDE - IC5,INCLUDE - IC6,132,10.1109/MICRO61859.2024.00103,J. Stojkovic; E. Choukse; E. Saurez; Í. Goiri; J. Torrellas,Mosaic: Harnessing the Micro-Architectural Resources of Servers in Serverless Environments,2024 57th IEEE/ACM International Symposium on Microarchitecture (MICRO),,2379-3155,,03-Dec-24,,,,,IEEE,,"With serverless computing, users develop scalable applications using lightweight functions as building blocks, while cloud providers own most of the computing stack, allowing for better resource optimizations. In this paper, we observe that modern server-class processors are inefficiently utilized in serverless environments. Cores perform frequent context switches within function invocations and have a high degree of oversubscription. In such an environment, functions frequently lose their micro-architectural state in stateful hardware structures like caches, TLBs, and branch predictors, causing performance degradation. At the same time, modern processors are dimensioned for the needs of a broad set of applications, rendering them suboptimal for serverless workloads. Based on these insights, we propose Mosaic, an architecture optimized for serverless environments that maintains generality to efficiently support other workloads. Mosaic has two components: (1) MosaicCPU, a processor architecture that efficiently runs both serverless workloads and traditional monolithic applications, and (2) MosaicScheduler, a software stack for serverless systems that maximizes the benefits of MosaicCPU. MosaicCPU slices micro-architectural structures into small chunks and assigns tiles of such chunks to functions. The processor retains the state of functions in their tiles across context switches, thereby improving performance. Furthermore, currently-inactive tiles are set to a low power mode, thereby reducing energy consumption. In addition, MosaicScheduler maximizes efficiency by introducing predictive right-sizing of the per-function tiles, alongside with smart scheduling based on the state of the tiles. Overall, compared to conventional server-class processors, Mosaic improves the throughput of serverless workloads by 225% while using 22% less power.",979-8-3503-5057-9,"NSF(grant numbers:CNS 1956007,CCF 2107470,CCF 2316233); Semiconductor Research Corporation (SRC); DARPA; ",https://ieeexplore.ieee.org/stamp/stamp.jsp?arnumber=10764517,Cloud computing;Serverless computing;Hardware partitioning,,,,91,IEEE,,,,,,,,,,,,,,,,,Context;Schedules;Program processors;Processor scheduling;Full stack;Serverless computing;Computer architecture;Throughput;Rendering (computer graphics);Optimization,EC3,60,0
Included,3,1,IC6,1,IC5,1,IC5,INCLUDE - IC5,INCLUDE - IC5,195,10.24425/ijet.2024.152511,Nuñez I.; Rovetto C.; Cruz E.; Smolarz A.; Concepcion D.; Cano E.E.,Design of a microservices-based architecture for residential energy efficiency monitoring,,,,,,,,,,,,"With the significant advancement of electrical infrastructure in the context of smart buildings and smart homes, the need arises to overcome the limitations of the traditional energy efficiency control system based on service-oriented architecture (SOA). To address these challenges, this study proposes a distributed architecture based on microservices, with the main objective of improving the performance and stability of these systems. This proposal seeks to enable end users to effectively monitor and control their electrical devices while effectively integrating them into a wide network of power systems. The proposed architecture relies on a series of cloud services that enable better performance and control in energy efficiency management, highlighting key features of microservices such as fault tolerance, performance, and scalability. Using a structural methodology centered on preexisting components and an iterative approach, a versatile and scalable architecture was designed that addresses current challenges in energy efficiency management. The results show a significant impact on key performance indicators such as demand response, energy savings, and power quality, highlighting the resilience and scalability of the proposed architecture. The conclusions highlight the importance of energy efficiency in reducing the environmental impact and costs associated with electric power, suggesting future improvements in data access and the implementation of advanced machine learning algorithms. © The Author(s).",,,,energy efficiency; internet of things (IoT); Microservices; smart homes; software architecture,,,,,,,,"Nuñez, Ivonne (57988307500); Rovetto, Carlos (36700409000); Cruz, Edmanuel (57196730404); Smolarz, Andrzej (56249263000); Concepcion, Dimas (58745340600); Cano, Elia Esther (36699322600)",57988307500; 36700409000; 57196730404; 56249263000; 58745340600; 36699322600,2024,International Journal of Electronics and Telecommunications,,1089,1098,9,0,https://www.scopus.com/inward/record.uri?eid=2-s2.0-85208929675&doi=10.24425%2fijet.2024.152511&partnerID=40&md5=4d5e280c29c8e85db218bec4498c64b0,Final,All Open Access; Gold Open Access,Scopus,2-s2.0-85208929675,Service oriented architecture (SOA); Efficiency control; Efficiency managements; Electrical infrastructure; Energy; Internet of thing; Microservice; Performance; Proposed architectures; Residential energy efficiency; Smart homes; Smart homes,IC4,61,0
Included,3,1,IC5,1,IC5,1,IC5,INCLUDE - IC5,INCLUDE - IC5,154,10.1109/WCNCW.2019.8902860,G. Rigazzi; J. -P. Kainulainen; C. Turyagyenda; A. Mourad; J. Ahn,An Edge and Fog Computing Platform for Effective Deployment of 360 Video Applications,2019 IEEE Wireless Communications and Networking Conference Workshop (WCNCW),,,,18-Nov-19,,,,,IEEE,,"Immersive video applications based on 360 video streaming require high-bandwidth, high-reliability and low-latency 5G connectivity but also flexible, low-latency and cost-effective computing deployment. This paper proposes a novel solution for decomposing and distributing the end-to-end 360 video streaming service across three computing tiers, namely cloud, edge and constrained fog, in order of proximity to the end user client. The streaming service is aided with an adaptive viewport technique. The proposed solution is based on the H2020 5G-CORAL system architecture using micro-services-based design and a unified orchestration and control across all three tiers based on Fog05. Performance evaluation of the proposed solution shows noticeable reduction in bandwidth consumption, energy consumption, and deployment costs, as compared to a solution where the streaming service is all delivered out of one computing location such as the Cloud.",978-1-7281-0922-0,,https://ieeexplore.ieee.org/stamp/stamp.jsp?arnumber=8902860,eMBB;360 video;fog computing;edge computing,,12,,13,IEEE,,,,,,,,,,,,,,,,,Streaming media;Cloud computing;Edge computing;Servers;5G mobile communication;Bandwidth;Data centers,IC4,62,0
Included,3,1,IC6,1,IC5,1,IC5,INCLUDE - IC5,INCLUDE - IC5,145,10.1109/TITS.2021.3110725,C. Roy; R. Saha; S. Misra; K. Dev,Micro-Safe: Microservices- and Deep Learning-Based Safety-as-a-Service Architecture for 6G-Enabled Intelligent Transportation System,IEEE Transactions on Intelligent Transportation Systems,,1558-0016,,27-Sep-21,,,,,IEEE,,"In this paper, we propose a microservices and deep learning-based scheme, termed as Micro-Safe, for provisioning Safety-as-a-Service (Safe-aaS) in a 6G environment. A Safe-aaS infrastructure provides customized safety-related decisions dynamically to the registered end-users. As the decisions are time-sensitive in nature, the generation of these decisions should incur minimum latency and high accuracy. Further, scalability and extension of the coverage of the entire Safe-aaS platform are also necessary. Considering road transportation as the application scenario, we propose Safe-aaS, which is a microservices- and deep learning-based platform for provisioning ultra-low latency safety services to the end-users in a 6G scenario. We design the proposed solution in two stages. In the first stage, we develop the microservices-enabled application layer to improve the scalability and adaptability of the traditional Safe-aaS platform. Moreover, we apply the state space model to represent the decision parameters requested and the decision delivered to the end-users. During the second stage, we use deep learning models to improve the accuracy in the decisions delivered to the end-users. Additionally, we apply an assortment of activation functions to analyze and compare the accuracy of the decisions generated in the proposed scheme. Extensive simulation of our proposed scheme, Micro-Safe, demonstrates that latency is improved by 26.1 – 31.2%, energy consumption is reduced by 22.1 – 29.9%, throughput is increased by 26.1 – 31.7%, compared to the existing schemes.",,,https://ieeexplore.ieee.org/stamp/stamp.jsp?arnumber=9548710,6G;microservices;deep learning;state space model;safety-as-a-service (safe-aas);road transportation;decision parameters,,20,,28,IEEE,,,,,,,,,,,,,,,,,6G mobile communication;Safety;Deep learning;Scalability;Delays;Cloud computing;Throughput,IC4,63,0
Included,3,1,IC5,1,IC5,1,IC5,INCLUDE - IC5,INCLUDE - IC5,52,10.1109/ACCESS.2024.3486983,W. Villegas-Ch; R. Gutierrez; I. Sánchez-Salazar; A. Mera-Navarrete,Adaptive Security Framework for the Internet of Things: Improving Threat Detection and Energy Optimization in Distributed Environments,IEEE Access,,2169-3536,,28-Oct-24,,,,,IEEE,,"The increasing use of Internet of Things (IoT) devices in critical sectors has increased exposure to security threats, making protecting these systems a priority challenge. Based on static configurations, traditional security approaches have proven ineffective in the face of the dynamic nature of emerging threats, as they cannot adapt in real time to changes in the environment or new attack vectors. This work proposes an adaptive security framework for Internet of Things (IoT) systems capable of autonomously detecting, mitigating, and adapting to various threats, improving precision and response times, and optimizing energy consumption. The framework was implemented in a distributed Internet of Things environment, using adaptive architectures based on the Robot Operating System (ROS) and microservices orchestration with Kubernetes. The results showed a significant improvement in response time, with a reduction of 44%, reaching an average of 250 milliseconds, compared to 450 milliseconds for static approaches. Furthermore, a 92% precision in threat detection was achieved, reducing false positives to 4% and false negatives to 6%. Power consumption was controlled, reaching a maximum of 160 milliamp-hours after facing multiple threats, confirming the system’s efficiency in resource-limited environments. These results demonstrate that the proposed adaptive framework is a robust and efficient solution for security in Internet of Things environments, overcoming the limitations of traditional approaches and ensuring adequate protection without compromising energy efficiency.",,,https://ieeexplore.ieee.org/stamp/stamp.jsp?arnumber=10736580,Adaptive security framework;Internet of Things;threat detection;energy efficiency in Internet of Things,,,,44,CCBYNCND,,,,,,,,,,,,,,,,,Security;Internet of Things;Adaptive systems;Real-time systems;Time factors;Threat assessment;Energy consumption;Energy efficiency;Sensors;Logic gates,IC4,64,0
Included,3,1,IC6,1,IC5,1,IC5,INCLUDE - IC5,INCLUDE - IC5,77,10.1109/HPCA.2019.00032,C. -H. Chou; L. N. Bhuyan; D. Wong,μDPM: Dynamic Power Management for the Microsecond Era,2019 IEEE International Symposium on High Performance Computer Architecture (HPCA),,2378-203X,,28-Mar-19,,,,,IEEE,,"The complex, distributed nature of data centers have spawned the adoption of distributed, multi-tiered software architectures, consisting of many inter-connected microservices. These microservices exhibit extremely short request service times, often less than 250μs. We show that these “killer microsecond” service times can cause state-of-the-art dynamic power management techniques to break down, due to short idle period length and low power state transition overheads. In this paper, we propose μDPM, a dynamic power management scheme for the microsecond era that coordinates request delaying, per-core sleep states, and voltage frequency scaling. The idea is to postpone the wake up of a CPU as long as possible and then adjust the frequency so that the tail latency constraint of requests are satisfied just-in-time. μDPM reduces processor energy consumption by up to 32% and consistently outperforms state-of-the-art techniques by 2×.",978-1-7281-1444-6,,https://ieeexplore.ieee.org/stamp/stamp.jsp?arnumber=8675218,Dynamic power management;DVFS;Sleep states,,30,,57,IEEE,,,,,,,,,,,,,,,,,Power system management;Servers;Energy consumption;Power demand;Data centers;Market research;Linux,IC4,65,0
Included,3,1,IC6,1,IC6,1,IC6,INCLUDE - IC6,INCLUDE - IC6,32,10.1016/j.procs.2018.10.172,Lvarez-Valera H.H.; Roose P.; Dalmau M.; Herzog C.; Respicio K.,Kali green: A distributed scheduler for energy saving,,,,,,,,,,,,"A commonplace issue with portable technology is battery efficiency. While many industries are trying their best to improve battery life without sacrificing a products quality and efficiency, we believe that further can be done to improve battery consumption on ones mobile devicefrom tablets to smartphones to laptops to everything else. Many applications on these devices are based on a microservice architecture. In this article, we introduce a new algorithm KaliGreen that can maneuver the microservices within a network of devices in order to maximize the run-time of a microservice-based application; moreover, KaliGreen allows a 54% increase in the average run-time of an application by shifting microservices from 6 devices (as example) with low battery or inefficient processing ratios to devices in better conditions. To achieve this, KaliGreen utilizes KaliMucho middleware, which is able manipulate microservices in run-time. This algorithm provides a plausible solution to maximizing energy consumption within a network of devices. © 2018 The Authors. Published by Elsevier Ltd.",,,,Distributed applicatioggns; Green Computing; Microservices; Smartphones,,,,,,,,"Lvarez-Valera, Hernn H. (57205026453); Roose, Philippe (55843683500); Dalmau, Marc (6701309994); Herzog, Christina (55520060500); Respicio, Kyle (57205022716)",57205026453; 55843683500; 6701309994; 55520060500; 57205022716,2018,Procedia Computer Science,,223,230,7,7,https://www.scopus.com/inward/record.uri?eid=2-s2.0-85058349351&doi=10.1016%2fj.procs.2018.10.172&partnerID=40&md5=762a84024c90ed200594143af3fc90ed,Final,All Open Access; Gold Open Access,Scopus,2-s2.0-85058349351,Electric batteries; Energy conservation; Energy utilization; mHealth; Middleware; Smartphones; Battery consumption; Battery efficiencies; Battery life; Distributed applicatioggns; Distributed schedulers; Microservices; Portable technologies; Products quality; Green computing,,66,0
Included,3,1,IC5,1,IC5,1,IC5,INCLUDE - IC5,INCLUDE - IC5,6,10.1007/978-3-031-07472-1_6,"Vitali, Monica",Towards Greener Applications: Enabling Sustainable-aware Cloud Native Applications Design,"Advanced Information Systems Engineering: 34th International Conference, CAiSE 2022, Leuven, Belgium, June 6–10, 2022, Proceedings",978-3-031-07471-4,,https://doi.org/10.1007/978-3-031-07472-1_6,2022,,,,,Springer-Verlag,"Berlin, Heidelberg","Data centers energy demand is increasing. While a great deal of effort has been made to reduce the amount of CO2 generated by large cloud providers, too little has been done from the application perspective. We claim that application developers can impact the environmental footprint by enhancing the application design with additional features. Following the proposed Sustainable Application Design Process (SADP), the application design is enriched with information that can be leveraged by cloud providers to manage application execution in an energy-aware manner. This exploratory work aims to emphasize the awareness on the sustainability of applications by proposing a methodology for its evaluation. To this end, we first suggest possible actions to enrich the application design towards sustainability, and finally describe how this additional information can be leveraged in the application workflow. We discuss the feasibility of our methodology by referring to existing tools and technologies capable of supporting the design features proposed in a production environment.",,,,,,,,,,,,,,,,,,,,,,,,,,Cloud-native; Energy-efficiency; Sustainability-awareness; Sustainable applications; Workflow design,EC3 but maybe interesting,67,0
Included,3,1,IC5,1,IC5,1,IC5,INCLUDE - IC5,INCLUDE - IC5,11,10.1007/978-3-031-71142-8_2,Poth A.; Saalfeld L.,Improve IT Sustainability with IT Technology – Comparison of an Explore vs. Exploit Strategy (with a Case Study on Containerized Workloads),,,,,,,,,,,,"The size and complexity of IT systems is growing over time. Therefore, the resource unit footprint of an IT system grows, too. But what impact has an exploration strategy of new technologies to reduce the footprint? Based on a case study of a cloud service from the Volkswagen Group IT an exploration approach is compared with an exploitation approach. It presents the methodical approach and its effects on the resource unit footprint of a micro-service architecture of the IT service. The approach enables the DevOps team to beat Wirth’s law by keeping the footprint at least constant by offering more capabilities and features to their users. © The Author(s), under exclusive license to Springer Nature Switzerland AG 2024.",,,,Containerization; Green IT; Micro-Service; Native Image; Sustainability; Wirth’s law,,,,,,,,"Poth, Alexander (57207597845); Saalfeld, Luca (59337943700)",57207597845; 59337943700,2024,Communications in Computer and Information Science,,22,35,13,0,https://www.scopus.com/inward/record.uri?eid=2-s2.0-85204598573&doi=10.1007%2f978-3-031-71142-8_2&partnerID=40&md5=368aebc947fe40d0bd796c242e692b49,Final,,Scopus,2-s2.0-85204598573,Case-studies; Containerization; Exploration strategies; Green-IT; IT system; Micro services; Native image; Resource units; Technology comparison; Wirth’s law,EC3,68,0
