Decision,Sum,round_1_result (eoan),round_1_notes,round_2_result (ai),round_2_notes,round_3_result (ai),round_3_notes,round_2_full_output,round_3_full_output,record_id,DOI,Author,Title,Publication Title,ISBN,ISSN,Url,Date,Series,Series Number,Series Text,Series Title,Publisher,Place,Abstract,ISBNs,Funding Information,PDF Link,Author Keywords,Mesh_Terms,Article Citation Count,Patent Citation Count,Reference Count,License,Issue Date,Meeting Date,Author full names,Author(s) ID,Year,Source title,Art. No.,Page start,Page end,Page count,Cited by,Link,Publication Stage,Open Access,Source,EID,Keywords,exported_notes_1,asreview_ranking,asreview_prior
Included,3,1,IC6,1,IC5,1,IC5,INCLUDE - IC5,INCLUDE - IC5,17,10.1007/s10723-024-09789-9,Agos Jawaddi S.N.; Ismail A.; Sulaiman M.S.; Cardellini V.,Analyzing Energy-Efficient and Kubernetes-Based Autoscaling of Microservices Using Probabilistic Model Checking,,,,,,,,,,,,"Microservices are widely used to enable agility and scalability in modern software systems, while cloud computing offers cost-effective ways to provision computing resources on demand. However, ensuring the correctness of scaling decisions and their impact on energy consumption is a challenging problem that has not been sufficiently addressed in previous research. Thus, in this paper, we present an innovative approach for analyzing host energy consumption and energy violations influenced by microservice autoscaling policies using probabilistic model checking (PMC). We propose four variations of the Markov Decision Process (MDP) models that incorporate various scaling constraints inspired by Kubernetes-based Horizontal Pod Autoscaler, and we encode these models using two different approaches, namely, bounded-by-action (BBA) and bounded-by-state (BBS). We use PMC to verify the scaling policies in terms of host energy consumption and energy violations, and we conduct sensitivity analysis to demonstrate the effectiveness of our models in generating energy-efficient scaling policies. Our results show that the latency and energy-based MDP model offers the most suitable policies for ensuring energy efficiency in microservice systems. Additionally, the number of pods and the scale-out action significantly affect energy consumption and violations. Sensitivity analysis also reveals that incorporating latency into scaling decisions is key to energy efficiency, while variations in the maximum pod threshold significantly influence energy consumption and violation. Our approach provides a formal method for ensuring the correctness of microservice autoscaling decisions in cloud environments at design time and can help reduce energy consumption and violations while ensuring service-level objectives are met. © The Author(s), under exclusive licence to Springer Nature B.V. 2024.",,,,Energy-driven microservice autoscaling; Formal verification; Kubernetes; Markov decision process; Microservices; Probabilistic model checking,,,,,,,,"Agos Jawaddi, Siti Nuraishah (58283711400); Ismail, Azlan (55377382600); Sulaiman, Mohd Suffian (57212956093); Cardellini, Valeria (6603463586)",58283711400; 55377382600; 57212956093; 6603463586,2025,Journal of Grid Computing,3,,,,0,https://www.scopus.com/inward/record.uri?eid=2-s2.0-85213696655&doi=10.1007%2fs10723-024-09789-9&partnerID=40&md5=2351a5b1f5d24e45730f45c2899e134e,Final,,Scopus,2-s2.0-85213696655,Cloud computing; Energy efficiency; Formal verification; Health risks; Model checking; Program debugging; Sensitivity analysis; Autoscaling; Energy-consumption; Energy-driven; Energy-driven microservice autoscaling; Kubernetes; Markov Decision Processes; Microservice; Probabilistic model checking; Probabilistic model-checking; Scalings; Markov processes,IC4,22,0
Included,3,1,IC6,1,IC6,1,IC6,INCLUDE - IC6,INCLUDE - IC6,144,10.1109/TGCN.2024.3420957,Z. Bellal; L. Lahlou; N. Kara; I. El Khayat,GAS: DVFS-Driven Energy Efficiency Approach for Latency-Guaranteed Edge Computing Microservices,IEEE Transactions on Green Communications and Networking,,2473-2400,,01-Jul-24,,,,,IEEE,,"Edge computing-based microservices (ECM) are pivotal infrastructure components for latency-critical applications such as Virtual Reality/Augmented Reality (VR/AR) and the Internet of Things (IoT). ECM involves strategically deploying microservices at the network’s edge to fulfill the low latency needs of modern applications. However, achieving efficient resource and energy consumption while meeting the latency requirement in the ECM environment remains challenging. Dynamic Voltage and Frequency Scaling (DVFS) is a common technique to address this issue. It adjusts the CPU frequency and voltage to balance energy cost and performance. However, selecting the optimal CPU frequency depends on the nature of the microservice workload (e.g., CPU-bound, memory-bound, or mixed). Moreover, various microservices with different latency requirement can be deployed on the same edge node. This makes the DVFS application extremely challenging, particularly for a chip-wide DVFS implementation for which CPU cores operate at the same frequency and voltage. To this end, we propose GAS, enerGy Aware microServices edge computing framework, which enables CPU frequency scaling to meet diverse microservice latency requirement with the minimum energy cost. Our evaluation indicates that our CPU scaling policy decreases energy consumption by 5% to 23% compared to Linux governors while maintaining latency requirement and significantly contributing to sustainable edge computing.",,Natural Sciences and Engineering Research Council and Ericsson Canada(grant numbers:561771);,https://ieeexplore.ieee.org/stamp/stamp.jsp?arnumber=10578041,Edge computing;microservice;DVFS;energy-efficient;container autoscaling,,,,42,IEEE,,,,,,,,,,,,,,,,,Microservice architectures;Edge computing;Energy consumption;Energy efficiency;Task analysis;Frequency diversity;Time-frequency analysis,IC4,23,0
Included,3,1,IC6,1,IC5,1,IC5,INCLUDE - IC5,INCLUDE - IC5,211,10.3390/s23167142,Ashraf M.; Shiraz M.; Abbasi A.; Alqahtani O.; Badshah G.; Lasisi A.,Microservice Application Scheduling in Multi-Tiered Fog-Computing-Enabled IoT,,,,,,,,,,,,"Fog computing extends mobile cloud computing facilities at the network edge, yielding low-latency application execution. To supplement cloud services, computationally intensive applications can be distributed on resource-constrained mobile devices by leveraging underutilized nearby resources to meet the latency and bandwidth requirements of application execution. Building upon this premise, it is necessary to investigate idle or underutilized resources that are present at the edge of the network. The utilization of a microservice architecture in IoT application development, with its increased granularity in service breakdown, provides opportunities for improved scalability, maintainability, and extensibility. In this research, the proposed schedule tackles the latency requirements of applications by identifying suitable upward migration of microservices within a multi-tiered fog computing infrastructure. This approach enables optimal utilization of network edge resources. Experimental validation is performed using the iFogSim2 simulator and the results are compared with existing baselines. The results demonstrate that compared to the edgewards approach, our proposed technique significantly improves the latency requirements of application execution, network usage, and energy consumption by 66.92%, 69.83%, and 4.16%, respectively. © 2023 by the authors.",,,,constrained devices; distributed application execution; fog computing; Internet of Things; microservice application scheduling; service delay,,,,,,,,"Ashraf, Maria (57702958100); Shiraz, Muhammad (36708730400); Abbasi, Almas (36863336500); Alqahtani, Omar (58548087400); Badshah, Gran (56039177200); Lasisi, Ayodele (56031891700)",57702958100; 36708730400; 36863336500; 58548087400; 56039177200; 56031891700,2023,Sensors,7142,,,,4,https://www.scopus.com/inward/record.uri?eid=2-s2.0-85168718295&doi=10.3390%2fs23167142&partnerID=40&md5=f6405c7cd0477185b8755c231e135338,Final,All Open Access; Gold Open Access; Green Open Access,Scopus,2-s2.0-85168718295,Energy utilization; Fog; Internet of things; Mobile cloud computing; Application execution; Application scheduling; Computing facilities; Constrained devices; Distributed application executions; Low latency; Microservice application scheduling; Multi-tiered; Network edges; Service delays; Fog computing,IC4,24,0
Included,3,1,IC6,1,IC5,1,IC5,INCLUDE - IC5,INCLUDE - IC5,116,10.1109/JIOT.2020.2981958,A. Samanta; J. Tang,Dyme: Dynamic Microservice Scheduling in Edge Computing Enabled IoT,IEEE Internet of Things Journal,,2327-4662,,19-Mar-20,,,,,IEEE,,"In recent years, the rapid development of mobile edge computing (MEC) provides an efficient execution platform at the edge for Internet-of-Things (IoT) applications. Nevertheless, the MEC also provides optimal resources to different microservices, however, underlying network conditions and infrastructures inherently affect the execution process in MEC. Therefore, in the presence of varying network conditions, it is necessary to optimally execute the available task of end users while maximizing the energy efficiency in edge platform and we also need to provide fair Quality-of-Service (QoS). On the other hand, it is necessary to schedule the microservices dynamically to minimize the total network delay and network price. Thus, in this article, unlike most of the existing works, we propose a dynamic microservice scheduling scheme for MEC. We design the microservice scheduling framework mathematically and also discuss the computational complexity of the scheduling algorithm. Extensive simulation results show that the microservice scheduling framework significantly improves the performance metrics in terms of total network delay, average price, satisfaction level, energy consumption rate (ECR), failure rate, and network throughput over other existing baselines.",,,https://ieeexplore.ieee.org/stamp/stamp.jsp?arnumber=9042873,Dynamic microservice scheduling;edge computing;Internet of Things (IoT);microservice;Quality-of-Service (QoS),,98,,56,IEEE,,,,,,,,,,,,,,,,,Dynamic scheduling;Task analysis;Internet of Things;Delays;Quality of service;Processor scheduling;Edge computing,IC4,25,0
Included,3,1,IC6,1,IC6,1,IC6,INCLUDE - IC6,INCLUDE - IC6,46,10.1109/ACCESS.2023.3330649,Y. Huang; X. Zhang; Z. Xu,SatEdge: Platform of Edge Cloud at Satellite and Scheduling Mechanism for Microservice Modules,IEEE Access,,2169-3536,,06-Nov-23,,,,,IEEE,,"Edge cloud at satellite (ECS) is a newly developed edge computing (EC) technology that uses EC services offered by satellites to support high reliability and seamless global coverage. Satellites assume the role of computing and storage nodes for edge clouds, while terrestrial control centers function as cloud centers. In this paper, we propose a novel system and software architecture for the ECS to improve the cloud management of satellite networks and increase the flexibility of satellite service provision at the edge. Then, we propose a platform for the ECS based on KubeEdge called SatEdge. SatEdge has many function modules to meet the needs of the satellite-terrestrial network (STN) such as high reliability, high flexibility, and low latency. On this platform, we designed a microservice scheduling algorithm called optimal microservice scheduling with adaptivity and mobility (OMS-AM). OMS-AM can schedule a globally optimal workflow for microservice modules on the satellites to minimize task processing latency, failed task rate, and energy consumption. Compared with our last work, OMS-AM reduces the task processing latency by 14% at most. Additionally, OMS-AM improves the mobility of the current scheduling method put forth in our previous study, which may help lower the task failure rate. Energy usage and the total normalized costs are additional indicators of the efficiency of the microservice architecture.",,"National Key Research and Development Program of China(grant numbers:2021YFB2900504,2020YFB1807900); ",https://ieeexplore.ieee.org/stamp/stamp.jsp?arnumber=10309921,Edge cloud at satellite;satellite-terrestrial network;edge computing;microservice scheduling,,3,,29,CCBYNCND,,,,,,,,,,,,,,,,,Satellites;Microservice architectures;Cloud computing;Computer architecture;Containers;Edge computing;Task analysis,IC4,26,0
Included,3,1,IC6,1,IC6,1,IC6,INCLUDE - IC6,INCLUDE - IC6,65,10.1109/COMSNETS56262.2023.10041344,I. Syrigos; D. Kefalas; N. Makris; T. Korakis,EELAS: Energy Efficient and Latency Aware Scheduling of Cloud-Native ML Workloads,2023 15th International Conference on COMmunication Systems & NETworkS (COMSNETS),,2155-2509,,15-Feb-23,,,,,IEEE,,"The widespread use of microservices and the use of cloud-native methodologies for the deployment of services have increased the service providers' flexibility and management efficiency. As the available resources for scheduling such work-loads have extended the boundaries of traditional datacenters to the fog, edge, and beyond -edge, the scheduling of challenging workloads must also account for energy efficiency, as these devices are typically battery-powered and resource-constrained, while maintaining acceptable performance. Specifically for ML inference workloads, provisioning and access latency plays a cru-cial role in their successful operation. Towards combating these issues, we design, develop, and evaluate our platform for Energy Efficient Latency-Aware Scheduling (EELAS) of workloads. First, we formulate the scheduling problem as an ILP problem, and then we develop a less complex heuristic method that allows the efficient allocation of resources within the continuum. Our EELAS prototype integrates with Kubernetes and is capable of reducing the overall energy consumption of cloud-to-things resources while accounting for latency of ML workloads. Our evaluation in real-world settings reveals significant energy gains for scheduling ML inference tasks, also reachable with the minimum possible latency from far-edge devices.",978-1-6654-7706-2,,https://ieeexplore.ieee.org/stamp/stamp.jsp?arnumber=10041344,cloud-to-things continuum;energy efficiency;latency aware;workload scheduling;testbed,,1,,18,IEEE,,,,,,,,,,,,,,,,,Training;Performance evaluation;Learning systems;Heuristic algorithms;Prototypes;Microservice architectures;Energy efficiency,IC4,27,0
Included,3,1,IC5,1,IC5,1,IC5,INCLUDE - IC5,INCLUDE - IC5,182,10.1145/3663741.3664789,"Ordonez, Carlos; Macyna, Wojciech; Bellatreche, Ladjel",Energy-Aware Analytics in the Cloud,Proceedings of the International Workshop on Big Data in Emergent Distributed Environments,979-8-4007-0679-0,,https://doi.org/10.1145/3663741.3664789,2024,BiDEDE '24,,,,Association for Computing Machinery,"New York, NY, USA","Big data is now mostly processed in the cloud and will keep growing, fed by databases and the Internet of Things (IoT: sensors, mobile devices, edge computing). On the other hand, AI is pushing computers and data analysis to limits we had not witnessed before. Analytics in the cloud is now a major fraction of energy consumption, among other less CPU-intensive tasks like web services. With this green computing motivation in mind, we present a survey of past research and a vision of big data analytics in the cloud. Energy consumption is difficult to minimize because it has conflicting correlated variables behind: high performance, money cost and pollution, We identify which software subsystems and hardware components have a higher impact on energy consumption, understanding how they can be tweaked or tuned to optimize energy consumption.",,,,,,,,,,,,,,,,,,,,,,,,,,,EC3 but maybe interesting,28,0
Included,3,1,IC6,1,IC5,1,IC5,INCLUDE - IC5,INCLUDE - IC5,41,10.1109/ACCESS.2022.3170918,A. Ali; M. M. Iqbal,A Cost and Energy Efficient Task Scheduling Technique to Offload Microservices Based Applications in Mobile Cloud Computing,IEEE Access,,2169-3536,,28-Apr-22,,,,,IEEE,,"The number of smartphone users and mobile devices has increased significantly. The Mobile Cloud Applications based on cloud computing have also been increased. The mobile apps can be used in Augmented Reality, E-Transportation, 2D/3-D Games, E-Healthcare, and Education. The modern cloud-based frameworks provide such services on Virtual Machines. The existing frameworks worked well, but these suffered the problems such as overhead, resource utilization, lengthy boot-time, and cost of running Mobile Applications. This study addresses these problems by proposing a Dynamic Decision-Based Task Scheduling Technique for Microservice-based Mobile Cloud Computing Applications (MSCMCC). The MSCMCC runs delay-sensitive applications and mobility with less cost than existing approaches. The study focused on Task Scheduling problems on heterogeneous Mobile Cloud servers. We further propose Task Scheduling and Microservices based Computational Offloading (TSMCO) framework to solve the Task Scheduling in steps, such as Resource Matching, Task Sequencing, and Task Scheduling. Furthermore, the experimental results elaborate that the proposed MSCMCC and TSMCO enhance the Mobile Server Utilization. The proposed system effectively minimizes the cost of healthcare applications by 25%, augmented reality by 23%, E-Transport tasks by 21%, and 3-D games tasks by 19%, the average boot-time of microservices applications by 17%, resource utilization by 36%, and tasks arrival time by 16%.",,"University of Engineering and Technology, Taxila, Pakistan; ",https://ieeexplore.ieee.org/stamp/stamp.jsp?arnumber=9764765,Cloud computing;mobile cloud computing;task offloading;task sequencing;task scheduling;microservices,,28,,52,CCBY,,,,,,,,,,,,,,,,,Task analysis;Cloud computing;Costs;Processor scheduling;Microservice architectures;Mobile handsets;Servers,IC3,29,0
Included,3,1,IC6,1,IC5,1,IC5,INCLUDE - IC5,INCLUDE - IC5,174,10.1145/3565010.3569065,"Tootaghaj, Diman Zad; Mercian, Anu; Adarsh, Vivek; Sharifian, Mehrnaz; Sharma, Puneet",SmartNICs at edge for transient compute elasticity,Proceedings of the 3rd International Workshop on Distributed Machine Learning,978-1-4503-9922-7,,https://doi.org/10.1145/3565010.3569065,2022,DistributedML '22,,,,Association for Computing Machinery,"New York, NY, USA","This paper proposes a new architecture that strategically harvests the untapped compute capacity of the SmartNICs to offload transient microservices workload spikes, thereby reducing the SLA violations while providing better performance/energy consumption. This is particularly important for ML workloads at Edge deployments with stringent SLA requirements. Usage of the untapped compute capacity is more favorable than deploying extra servers, as SmartNICs are economically and operationally more desirable. We propose Spike-Offload, a low-cost and scalable platform that leverages machine learning to predict the spikes and orchestrates seamless offloading of generic microservices workloads to the SmartNICs, eliminating the need for pre-deploying expensive host servers and their under-utilization. Our SpikeOffload evaluation shows that SLA violations can be reduced by up to 20% for specific workloads. Furthermore, we demonstrate that for specific workloads our approach can potentially reduce capital expenditure (CAPEX) by more than 40%. Also, performance per unit energy consumption can be improved by upto 2X.",,,,,,,,,,,,,,,,,,,,,,,,,,edge; serverless computing; application offload; SmartNIC,IC4,30,0
Included,3,1,IC6,1,IC5,1,IC5,INCLUDE - IC5,INCLUDE - IC5,94,10.1109/ICSA59870.2024.00012,Cortellessa V.; Di Pompeo D.; Tucci M.,Exploring Sustainable Alternatives for the Deployment of Microservices Architectures in the Cloud,,,,,,,,,,,,"As organizations increasingly migrate their applications to the cloud, the optimization of microservices architectures becomes imperative for achieving sustainability goals. Nonetheless, sustainable deployments may increase costs and deteriorate performance, thus the identification of optimal trade-offs among these conflicting requirements is a key objective not easy to achieve. This paper introduces a novel approach to support cloud deployment of microservices architectures by targeting optimal combinations of application performance, deployment costs, and power consumption. By leveraging genetic algorithms, specifically NSGA-II, we automate the generation of alternative architectural deployments. The results demonstrate the potential of our approach through a comprehensive assessment of the Train Ticket case study.  © 2024 IEEE.",,,,model-driven engineering; performance; refactoring; search-based software engineering; sustainability,,,,,,,,"Cortellessa, Vittorio (6603764364); Di Pompeo, Daniele (57188727238); Tucci, Michele (55317706000)",6603764364; 57188727238; 55317706000,2024,"Proceedings - IEEE 21st International Conference on Software Architecture, ICSA 2024",,34,45,11,1,https://www.scopus.com/inward/record.uri?eid=2-s2.0-85201051178&doi=10.1109%2fICSA59870.2024.00012&partnerID=40&md5=ebb3d2628f5d1191a5b97bd9115b93a3,Final,All Open Access; Green Open Access,Scopus,2-s2.0-85201051178,Computer architecture; Economic and social effects; Genetic algorithms; Sustainable development; Cloud deployments; Key objective; Model-driven Engineering; Optimal combination; Optimisations; Performance; Refactorings; Search-based; Search-based software engineering; Trade off; Software engineering,IC4,31,0
Included,3,1,IC5,1,IC5,1,IC5,INCLUDE - IC5,INCLUDE - IC5,122,10.1109/JIOT.2024.3488283,Golec M.; Wu H.; Ozturac R.; Parlikad A.K.; Cuadrado F.; Gill S.S.; Uhlig S.,CAPTAIN: A Testbed for Co-Simulation of Scalable Serverless Computing Environments for AIoT Enabled Predictive Maintenance in Industry 4.0,,,,,,,,,,,,"The massive amounts of data generated by the Industrial Internet of Things (IIoT) require considerable processing power, which increases carbon emissions and energy usage, and we need sustainable solutions to enable flexible manufacturing. Serverless computing shows potential for meeting this requirement by scaling idle containers to zero energy-efficiency and cost, but this will lead to a cold start delay. Most solutions rely on idle containers, which necessitates dynamic request time forecasting and container execution monitoring. Furthermore, Artificial Intelligence of Things (AIoT) can provide autonomous and sustainable solutions by combining IIoT with Artificial Intelligence (AI) to solve this problem. Therefore, we develop a new testbed, CAPTAIN, to facilitate AI-based co-simulation of scalable and flexible serverless computing in IIoT environments. The AI module in the CAPTAIN framework employs Random Forest (RF) and Light Gradient-Boosting Machine (LightGBM) models to optimize cold start frequency and prevent cold starts based on their prediction results. The proxy module additionally monitors the client-server network and constantly updates the AI module training dataset via a message queue. Finally, we evaluated the proxy module's performance using a predictive maintenance-based real-world IIoT application and the AI module's performance in a realistic serverless environment using a Microsoft Azure dataset. The AI module of the CAPTAIN outperforms baselines in terms of cold start frequency, computational time with 0.5 milliseconds, energy consumption with 1161.0 joules, and CO2 emissions with 32.25e-05 gCO2. The CAPTAIN testbed provides a co-simulation of sustainable and scalable serverless computing environments for AIoT-enabled predictive maintenance in Industry 4.0. © 2014 IEEE.",,,,Artificial Intelligence; Cloud Computing; Flexible Manufacturing; Industrial Internet of Things; Predictive Maintenance; Serverless Computing,,,,,,,,"Golec, Muhammed (57219976731); Wu, Huaming (55605704300); Ozturac, Ridvan (57226449916); Parlikad, Ajith Kumar (9736080300); Cuadrado, Felix (23008194000); Gill, Sukhpal Singh (57216940144); Uhlig, Steve (55148419500)",57219976731; 55605704300; 57226449916; 9736080300; 23008194000; 57216940144; 55148419500,2024,IEEE Internet of Things Journal,,,,,1,https://www.scopus.com/inward/record.uri?eid=2-s2.0-85208228417&doi=10.1109%2fJIOT.2024.3488283&partnerID=40&md5=79d9c5a8dcade2dfbbff6960c6a42c9a,Article in press,,Scopus,2-s2.0-85208228417,Competition; Flexible manufacturing systems; Glass plants; Plastic bottles; Windows operating system; Cloud-computing; Cold-start; Computing environments; Cosimulation; Flexible manufacturing; Industrial internet of thing; Module performance; Predictive maintenance; Serverless computing; Sustainable solution; Testbeds,EC3,33,0
